{
  "schema_version": 1,
  "dataset_id": "rourkela-curated-rag",
  "dataset_version": "1.0.0",
  "origin": "curated",
  "description": "100 authored development cases, not users: 60 attraction questions, 20 restaurant questions, 10 multi-document questions, 10 unsupported questions. References are derived from the bundled corpus, not externally fact-checked.",
  "corpus": [
    {
      "path": "rag.json",
      "sha256": "4d9f2e483cc48fb1344a488519f727e598ef4aedb8eb965197649717483052cd"
    },
    {
      "path": "restaurants_rourkela.json",
      "sha256": "062b8135fd1754c83b83d669a202d4fdd681b1fa450f76051a7590d99246b16c"
    }
  ],
  "cases": [
    {
      "id": "rkl-001",
      "question": "How tall is the Hanuman statue at Hanuman Vatika?",
      "category": "named_entity",
      "answerable": true,
      "relevant_doc_ids": [
        "rag.json:religious_1"
      ],
      "reference_answers": [
        "The Hanuman statue at Hanuman Vatika is 75 feet tall."
      ],
      "evidence": [
        {
          "doc_id": "rag.json:religious_1",
          "quote": "{\"id\": \"religious_1\", \"title\": \"Hanuman Vatika\", \"content\": \"Hanuman Vatika is a popular temple complex in Rourkela featuring one of the tallest statues of Hanuman at 75 feet. The complex contains multiple shrines, gardens, and a kalyan mandap, making it ideal for families and community gatherings. Best visited in the evening for cooler weather.\", \"lat\": 22.23, \"lng\": 84.826}"
        }
      ]
    },
    {
      "id": "rkl-002",
      "question": "Which Rourkela temple complex features a 75-foot Hanuman statue?",
      "category": "named_entity",
      "answerable": true,
      "relevant_doc_ids": [
        "rag.json:religious_1"
      ],
      "reference_answers": [
        "Hanuman Vatika features the 75-foot Hanuman statue."
      ],
      "evidence": [
        {
          "doc_id": "rag.json:religious_1",
          "quote": "{\"id\": \"religious_1\", \"title\": \"Hanuman Vatika\", \"content\": \"Hanuman Vatika is a popular temple complex in Rourkela featuring one of the tallest statues of Hanuman at 75 feet. The complex contains multiple shrines, gardens, and a kalyan mandap, making it ideal for families and community gatherings. Best visited in the evening for cooler weather.\", \"lat\": 22.23, \"lng\": 84.826}"
        }
      ]
    },
    {
      "id": "rkl-003",
      "question": "What facilities besides the main statue are described at Hanuman Vatika?",
      "category": "named_entity",
      "answerable": true,
      "relevant_doc_ids": [
        "rag.json:religious_1"
      ],
      "reference_answers": [
        "Hanuman Vatika contains multiple shrines, gardens, and a kalyan mandap."
      ],
      "evidence": [
        {
          "doc_id": "rag.json:religious_1",
          "quote": "{\"id\": \"religious_1\", \"title\": \"Hanuman Vatika\", \"content\": \"Hanuman Vatika is a popular temple complex in Rourkela featuring one of the tallest statues of Hanuman at 75 feet. The complex contains multiple shrines, gardens, and a kalyan mandap, making it ideal for families and community gatherings. Best visited in the evening for cooler weather.\", \"lat\": 22.23, \"lng\": 84.826}"
        }
      ]
    },
    {
      "id": "rkl-004",
      "question": "When should I visit Hanuman Vatika for cooler weather?",
      "category": "paraphrase",
      "answerable": true,
      "relevant_doc_ids": [
        "rag.json:religious_1"
      ],
      "reference_answers": [
        "Visit Hanuman Vatika in the evening for cooler weather."
      ],
      "evidence": [
        {
          "doc_id": "rag.json:religious_1",
          "quote": "{\"id\": \"religious_1\", \"title\": \"Hanuman Vatika\", \"content\": \"Hanuman Vatika is a popular temple complex in Rourkela featuring one of the tallest statues of Hanuman at 75 feet. The complex contains multiple shrines, gardens, and a kalyan mandap, making it ideal for families and community gatherings. Best visited in the evening for cooler weather.\", \"lat\": 22.23, \"lng\": 84.826}"
        }
      ]
    },
    {
      "id": "rkl-005",
      "question": "Which attraction has a kalyan mandap for community gatherings?",
      "category": "paraphrase",
      "answerable": true,
      "relevant_doc_ids": [
        "rag.json:religious_1"
      ],
      "reference_answers": [
        "Hanuman Vatika has a kalyan mandap and is suitable for community gatherings."
      ],
      "evidence": [
        {
          "doc_id": "rag.json:religious_1",
          "quote": "{\"id\": \"religious_1\", \"title\": \"Hanuman Vatika\", \"content\": \"Hanuman Vatika is a popular temple complex in Rourkela featuring one of the tallest statues of Hanuman at 75 feet. The complex contains multiple shrines, gardens, and a kalyan mandap, making it ideal for families and community gatherings. Best visited in the evening for cooler weather.\", \"lat\": 22.23, \"lng\": 84.826}"
        }
      ]
    },
    {
      "id": "rkl-006",
      "question": "Can a family visit Hanuman Vatika together?",
      "category": "paraphrase",
      "answerable": true,
      "relevant_doc_ids": [
        "rag.json:religious_1"
      ],
      "reference_answers": [
        "Hanuman Vatika is suitable for families and community gatherings."
      ],
      "evidence": [
        {
          "doc_id": "rag.json:religious_1",
          "quote": "{\"id\": \"religious_1\", \"title\": \"Hanuman Vatika\", \"content\": \"Hanuman Vatika is a popular temple complex in Rourkela featuring one of the tallest statues of Hanuman at 75 feet. The complex contains multiple shrines, gardens, and a kalyan mandap, making it ideal for families and community gatherings. Best visited in the evening for cooler weather.\", \"lat\": 22.23, \"lng\": 84.826}"
        }
      ]
    },
    {
      "id": "rkl-007",
      "question": "To whom is Vedvyas Temple dedicated?",
      "category": "named_entity",
      "answerable": true,
      "relevant_doc_ids": [
        "rag.json:religious_2"
      ],
      "reference_answers": [
        "Vedvyas Temple is dedicated to sage Vedvyas, the author of the Mahabharata."
      ],
      "evidence": [
        {
          "doc_id": "rag.json:religious_2",
          "quote": "{\"id\": \"religious_2\", \"title\": \"Vedvyas Temple\", \"content\": \"Vedvyas Temple is dedicated to sage Vedvyas, the author of the Mahabharata. It is located at the confluence of the Brahmani, Koel, and Saraswati rivers, approximately 20 km from Rourkela. The atmosphere is peaceful and spiritual, usually less crowded.\", \"lat\": 22.2355, \"lng\": 84.7864}"
        }
      ]
    },
    {
      "id": "rkl-008",
      "question": "Which rivers meet near Vedvyas Temple?",
      "category": "named_entity",
      "answerable": true,
      "relevant_doc_ids": [
        "rag.json:religious_2"
      ],
      "reference_answers": [
        "The Brahmani, Koel, and Saraswati rivers meet near Vedvyas Temple."
      ],
      "evidence": [
        {
          "doc_id": "rag.json:religious_2",
          "quote": "{\"id\": \"religious_2\", \"title\": \"Vedvyas Temple\", \"content\": \"Vedvyas Temple is dedicated to sage Vedvyas, the author of the Mahabharata. It is located at the confluence of the Brahmani, Koel, and Saraswati rivers, approximately 20 km from Rourkela. The atmosphere is peaceful and spiritual, usually less crowded.\", \"lat\": 22.2355, \"lng\": 84.7864}"
        }
      ]
    },
    {
      "id": "rkl-009",
      "question": "How far from Rourkela is Vedvyas Temple according to the record?",
      "category": "named_entity",
      "answerable": true,
      "relevant_doc_ids": [
        "rag.json:religious_2"
      ],
      "reference_answers": [
        "Vedvyas Temple is approximately 20 km from Rourkela."
      ],
      "evidence": [
        {
          "doc_id": "rag.json:religious_2",
          "quote": "{\"id\": \"religious_2\", \"title\": \"Vedvyas Temple\", \"content\": \"Vedvyas Temple is dedicated to sage Vedvyas, the author of the Mahabharata. It is located at the confluence of the Brahmani, Koel, and Saraswati rivers, approximately 20 km from Rourkela. The atmosphere is peaceful and spiritual, usually less crowded.\", \"lat\": 22.2355, \"lng\": 84.7864}"
        }
      ]
    },
    {
      "id": "rkl-010",
      "question": "Where can I visit a shrine associated with the author of the Mahabharata?",
      "category": "paraphrase",
      "answerable": true,
      "relevant_doc_ids": [
        "rag.json:religious_2"
      ],
      "reference_answers": [
        "Vedvyas Temple is dedicated to sage Vedvyas, the author of the Mahabharata."
      ],
      "evidence": [
        {
          "doc_id": "rag.json:religious_2",
          "quote": "{\"id\": \"religious_2\", \"title\": \"Vedvyas Temple\", \"content\": \"Vedvyas Temple is dedicated to sage Vedvyas, the author of the Mahabharata. It is located at the confluence of the Brahmani, Koel, and Saraswati rivers, approximately 20 km from Rourkela. The atmosphere is peaceful and spiritual, usually less crowded.\", \"lat\": 22.2355, \"lng\": 84.7864}"
        }
      ]
    },
    {
      "id": "rkl-011",
      "question": "Which temple is situated at a three-river confluence?",
      "category": "paraphrase",
      "answerable": true,
      "relevant_doc_ids": [
        "rag.json:religious_2"
      ],
      "reference_answers": [
        "Vedvyas Temple is at the confluence of the Brahmani, Koel, and Saraswati rivers."
      ],
      "evidence": [
        {
          "doc_id": "rag.json:religious_2",
          "quote": "{\"id\": \"religious_2\", \"title\": \"Vedvyas Temple\", \"content\": \"Vedvyas Temple is dedicated to sage Vedvyas, the author of the Mahabharata. It is located at the confluence of the Brahmani, Koel, and Saraswati rivers, approximately 20 km from Rourkela. The atmosphere is peaceful and spiritual, usually less crowded.\", \"lat\": 22.2355, \"lng\": 84.7864}"
        }
      ]
    },
    {